{
  "schemaVersion": 1,
  "productVariantId": "eh-smart-fan-1x",
  "productFamily": "smart_fan",
  "displayName": "EH Smart Fan 1X",
  "channelCount": 1,
  "channels": [
    {
      "channelIndex": 1,
      "defaultLabel": "Ceiling Fan",
      "capabilities": ["switch", "relay", "fan_speed", "local_switch", "energy", "ota"]
    }
  ],
  "hardwareProfile": {
    "schemaVersion": 1,
    "mcuFamily": "esp32-c6",
    "flashSizeBytes": 4194304,
    "psramSizeBytes": null,
    "hasEnergyMetering": true,
    "energyMeterChip": "BL0942",
    "maxRelayAmpsPerChannel": 5.0,
    "maxTotalAmps": 5.0,
    "gpioMap": {
      "relay_ch1": 18,
      "fan_regulator_ch1": 19,
      "switch_in_ch1": 4
    }
  },
  "connectivityProfile": {
    "schemaVersion": 1,
    "supportsWifi": true,
    "wifiStandards": ["802.11b", "802.11g", "802.11n", "802.11ax"],
    "supportsBle": true,
    "bleVersion": "5.0",
    "supportsThread": false,
    "threadVersion": null,
    "supportsMatter": false,
    "matterDeviceType": null
  },
  "capabilities": [
    "switch",
    "relay",
    "fan_speed",
    "local_switch",
    "energy",
    "voltage",
    "current",
    "power",
    "ota",
    "automation",
    "scene",
    "schedule"
  ],
  "electricalSpecifications": {
    "voltageRange": "90V - 250V AC",
    "frequencyHz": "50/60Hz",
    "maxCurrentPerChannelAmps": 5.0,
    "maxTotalCurrentAmps": 5.0
  },
  "images": {
    "hero": "assets/products/smart_fan_1x/hero.png",
    "front": "assets/products/smart_fan_1x/front.png",
    "thumbnail": "assets/products/smart_fan_1x/thumb.png"
  },
  "firmwareFamily": "esp32c6-fan-platform",
  "supportedHardwareRevisions": ["HW_1_0", "HW_1_1"]
}
