{
  "schemaVersion": 1,
  "productVariantId": "eh-smart-light-cct",
  "productFamily": "smart_lighting",
  "displayName": "EH Smart Light CCT",
  "channelCount": 1,
  "channels": [
    {
      "channelIndex": 1,
      "defaultLabel": "Light",
      "capabilities": ["switch", "brightness", "cct", "energy", "ota"]
    }
  ],
  "hardwareProfile": {
    "schemaVersion": 1,
    "mcuFamily": "esp32-c6",
    "flashSizeBytes": 4194304,
    "psramSizeBytes": null,
    "hasEnergyMetering": true,
    "energyMeterChip": "BL0942",
    "maxRelayAmpsPerChannel": 2.0,
    "maxTotalAmps": 2.0,
    "gpioMap": {
      "pwm_warm": 18,
      "pwm_cold": 19,
      "power_enable": 20
    }
  },
  "connectivityProfile": {
    "schemaVersion": 1,
    "supportsWifi": true,
    "wifiStandards": ["802.11b", "802.11g", "802.11n", "802.11ax"],
    "supportsBle": true,
    "bleVersion": "5.0",
    "supportsThread": true,
    "threadVersion": "1.3",
    "supportsMatter": true,
    "matterDeviceType": "0x010C"
  },
  "capabilities": [
    "switch",
    "brightness",
    "cct",
    "energy",
    "voltage",
    "current",
    "power",
    "ota",
    "automation",
    "scene",
    "schedule"
  ],
  "electricalSpecifications": {
    "voltageRange": "90V - 250V AC",
    "frequencyHz": "50/60Hz",
    "maxCurrentPerChannelAmps": 2.0,
    "maxTotalCurrentAmps": 2.0
  },
  "images": {
    "hero": "assets/products/smart_light_cct/hero.png",
    "front": "assets/products/smart_light_cct/front.png",
    "thumbnail": "assets/products/smart_light_cct/thumb.png"
  },
  "firmwareFamily": "esp32c6-light-platform",
  "supportedHardwareRevisions": ["HW_1_0"]
}
